d	Charles Tag	Categories	Adrien Tag	
Subject to the terms and conditions of this Agreement, you are hereby granted a non-exclusive, limited, non-transferable, revocable license to use the Service for your personal, noncommercial use only and as permitted by the features of the Service.	content_licence	content Licence	content_licence	
Edison collects, uses, and discloses your personal information as follows:	personnal_information	personnal information	personnal_information	
Location Information from Your Device.	non_personnal_information	non personnal information	non_personnal_information	
By linking our Services to your email or other internet accounts, you authorize us to collect, process, and retain information, including personal information, from those accounts.	personnal_information	personnal information	personnal_information	
The information collected about you could include your name, company name, address, phone number, email address, IP address, etc.	personnal_information	personnal information	personnal_information	
In order to purchase a service, you may need to provide to us with details such as billing name, billing contact details (street addresses, email addresses), and payment instrument details.	personnal_information	personnal information	personnal_information	
As part of registering for an account, we may collect information such as your name, username, email address, and password.	personnal_information	personnal information	personnal_information	
For example, we may collect device identifiers, browser types, device types and settings, operating system versions, mobile, wireless, and other network information (such as internet service provider name, carrier name and signal strength), and application version numbers.	non_personnal_information	non personnal information	non_personnal_information	
If you are invited to use an Pango service, the person who invited you may submit your personal data, such as your email address or other contact information.	personnal_information	personnal information	personnal_information	
You agree to pay for the subscription that you select for the Paid Service and you authorize us to automatically charge the payment method our service provider has on file for your recurring payments.	levy_automatic	levy automatic	levy_automatic	
By posting or publishing User Content, you grant AnchorFree a worldwide, non-exclusive, royalty-free, perpetual, irrevocable right and license (with the right to sublicense) to host, store, transfer, display, perform, reproduce, modify, and distribute your User Content, in whole or in part, in any media formats and through any media channels (now known or hereafter developed) without any compensation paid to you.	content_licence	content Licence	content_licence	
Once you have cancelled your automatic renewal, recurring subscription fees for AnchorFree Paid Service fees will no longer be charged to the payment method we have on file for your account, and your subscription will remain active only until the end of the term for which you have fully paid the AnchorFree Paid Service fee.	refund	refund	refund	
information reasonably sufficient to permit us to contact you, such as an address, telephone number, and, if available, an email address;	personnal_information	personnal information	personnal_information	
When you register or sign-in to the Services via your social network account (e.g., Facebook, Google+), we will have access to basic information from your social network account, such as your full name, home address, email address, birth date, profile picture, friends list, personal description, as well as any other information you made publicly available on such account or agreed to share with us.	personnal_information	personnal information	personnal_information	
device name, code, manufacturer and language;	non_personnal_information	non personnal information	non_personnal_information	
Some of those employees, contractors and affiliated organizations may be located outside of your home country;	data_management	data management	data_management	
You may cancel your subscription at any time by contacting our support team support@uvpn.me.	enrollment	enrollment	enrollment	
At the start of each subscription period, the third-party reseller in capacity of merchant of record will charge the Subscription Fee to your credit card or debit card on file as identified in your Account;	levy_automatic	levy automatic	levy_automatic	
Otherwise, all payments made according to these Terms are final and Company will not reimburse or refund any payments for any reason.	refund	refund	refund	
We may need to provide you with certain communications, such as service announcements and administrative messages.	acceptable_consent	acceptable_consent	acceptable_consent	
Additionally, you agree not to: (a) post, transmit, link to, or otherwise distribute any materials, information or content constituting, advocating or encouraging conduct that would constitute a criminal offense or give rise to civil liability, or otherwise use a Bell Media Site or any of the Services in a manner which is contrary to law or would serve to restrict or inhibit any other user from using or enjoying a Bell Media Site, any of the Services, or the Internet; (b) defame, abuse, stalk, harass, threaten or otherwise violate the legal rights of others including, without limitation, rights relating to privacy and publicity; (c) post, transmit, link to, or otherwise distribute any inappropriate, profane, defamatory, infringing, obscene, indecent or unlawful material or information; or (d) post, transmit, link to, or otherwise distribute any information, materials or content (including for greater certainty, software) which contains a virus, cancelbot, trojan horse, worm or other harmful or disruptive component.	acceptable_consent	acceptable_consent	acceptable_consent	
Agorize will decide, at its sole discretion, whether to lift the measures put in place.	acceptable_consent	acceptable_consent	acceptable_consent	
When this is necessary, you will be notified of such measure to enable you to respond.	acceptable_consent	acceptable_consent	acceptable_consent	
You must have authority to bind your business.	acceptable_consent	acceptable_consent	acceptable_consent	
Decisions made by Sponsors are considered final.	acceptable_consent	acceptable_consent	acceptable_consent	
of any of their products, services, or offers.	acceptable_consent	acceptable_consent	acceptable_consent	
any material, file, software or other element made available through the Site.	acceptable_consent	acceptable_consent	acceptable_consent	
not limited to all forms of television, wireless and online technology, now known or later developed.	acceptable_consent	acceptable_consent	acceptable_consent	
If material changes are made to the Site, Aeroplan will notify you of such changes.	acceptable_consent	acceptable_consent	acceptable_consent	
For more information about Canada click here.	acceptable_consent	acceptable_consent	acceptable_consent	
Turo can be contacted at the these addresses.	acceptable_consent	acceptable_consent	acceptable_consent	
may setoff amounts owed against funds held or processed by Square Canada.	acceptable_consent	acceptable_consent	acceptable_consent	
If you have registered for or purchased a product or services, including on a trial basis, your personal information will be used to provide that product or service, communicate about it and handle payments, as is necessary for the performance of the contract entered into.	acceptable_consent	acceptable_consent	acceptable_consent	
EU data protection laws give individuals a number of rights, where their data and information is processed by companies established in Europe.	acceptable_consent	acceptable_consent	acceptable_consent	
If any information is collected from a child under the age of 13 without verification of parental consent, it will be deleted.	acceptable_consent	acceptable_consent	acceptable_consent	
We serve commercial, professional and academic communities by helping them connect and learn, and by creating and providing access to content and intelligence that helps people and businesses work smarter and make better decisions faster.	acceptable_consent	acceptable_consent	acceptable_consent	
Depending on the laws of the country where you live, you may have other rights in respect of your personal information.	acceptable_consent	acceptable_consent	acceptable_consent	
Information on how to opt out will be given when your personal information is collected and specified on every marketing email sent.	acceptable_consent	acceptable_consent	acceptable_consent	
Data with special protections: You can choose to provide information in your Facebook profile fields or Life Events about your religious views, political views, who you are "interested in," or your health.	acceptable_consent	acceptable_consent	acceptable_consent	
In response to a legal request (like a search warrant, court order or subpoena) if we have a good faith belief that the law requires us to do so.	acceptable_consent	acceptable_consent	acceptable_consent	
But apps and websites you use will not be able to receive any other information about your Facebook friends from you, or information about any of your Instagram followers (although your friends and followers may, of course, choose to share this information themselves).	acceptable_consent	acceptable_consent	acceptable_consent	
Apps and websites you use may receive your list of Facebook friends if you choose to share it with them.	acceptable_consent	acceptable_consent	acceptable_consent	
For example, when you play a game with your Facebook friends or use a Facebook Comment or Share button on a website, the game developer or website can receive information about your activities in the game or receive a comment or link that you share from the website on Facebook.	acceptable_consent	acceptable_consent	acceptable_consent	
MTI is only available if we can match your personal information with your credit file.	acceptable_consent	acceptable_consent	acceptable_consent	
MTI is provided to you subject to your agreement to be bound by these terms and conditions of use ("Terms and Conditions").	acceptable_consent	acceptable_consent	acceptable_consent	
Except as provided in the preceding sentence, none of the Content may be copied, displayed, distributed, downloaded, licensed, modified, published, reposted, reproduced, reused, sold, transmitted, used to create a derivative work or otherwise used for public or commercial purposes without the express written permission of TransUnion Interactive or the owner of the Content.	acceptable_consent	acceptable_consent	acceptable_consent	
Where Turo is required to obtain your consent for such communications, you may choose to revoke your consent.	acceptable_consent	acceptable_consent	acceptable_consent	
If you offer the guest the option to pick up your vehicle at a persistent specified location, you must supply the location of the vehicle accurately to Turo and ensure that the vehicle is available at that location at the beginning of the reservation period.	acceptable_consent	acceptable_consent	acceptable_consent	
Disqus reserves the right to revoke your license to use the Service at any time and for any reason.	acceptable_consent	acceptable_consent	acceptable_consent	
You shall be solely responsible for your User Content and the consequences of posting or publishing it, and you agree that we are only acting as a passive conduit for your online distribution and publication of your User Content.	acceptable_consent	acceptable_consent	acceptable_consent	
Except as explicitly provided herein, nothing in these Terms shall be deemed to create a license in or to Disqus Content, and you agree not to sell, license, rent, modify, distribute, copy, reproduce, transmit, publicly display, publicly perform, publish, adapt, edit or create derivative works from any Disqus Content.	acceptable_consent	acceptable_consent	acceptable_consent	
You understand and agree that you may be exposed to User Content that is inaccurate, objectionable, inappropriate for children, or otherwise unsuited to your purpose, and you agree that Disqus shall not be liable for any damages you allege to incur as a result of User Content.	acceptable_consent	acceptable_consent	acceptable_consent	
License to Use the Service.	acceptable_consent	acceptable_consent	acceptable_consent	
Where we need to collect personal data by law, or under the terms of a contract we have with you and you fail to provide that data when requested, we may not be able to perform the contract we have or are trying to enter into with you (for example, to provide you with the Service).	acceptable_consent	acceptable_consent	acceptable_consent	
We do not collect any Special Categories of Personal Data about you (this includes details about your race or ethnicity, religious or philosophical beliefs, sex life, sexual orientation, political opinions, trade union membership, information about your health and genetic and biometric data).	acceptable_consent	acceptable_consent	acceptable_consent	
We may use both persistent cookies, which remain on your hard drive after you close your browser, and session cookies which terminate when you close your browser.	acceptable_consent	acceptable_consent	acceptable_consent	
Many browser settings can be set to decline cookies or alert you when a website is attempting to place a cookie.	acceptable_consent	acceptable_consent	acceptable_consent	
When you use the Service, or visit a Partner Site using the Service, we send one or more cookies to your computer that uniquely identifies your browser.	acceptable_consent	acceptable_consent	acceptable_consent	
If you withdraw your consent, we may not be able to provide certain products or services to you.	acceptable_consent	acceptable_consent	acceptable_consent	
These server logs may collect Technical Data such as your IP address, browser type, and information about the number of clicks and how you interact with links on the Service, Partner Sites, domain names, landing pages, pages viewed, and other such information.	non_personnal_information	non personnal information	non_personnal_information	
California Privacy Rights.	acceptable_consent	acceptable_consent	acceptable_consent	
We may need to request specific information from you to help us confirm your identity and ensure your right to access your personal data (or to exercise any of your other rights).	personnal_information	personnal information	personnal_information	
We will only use your personal data when the law allows us to.	acceptable_consent	acceptable_consent	acceptable_consent	
In some cases, we may demonstrate that we have compelling legitimate grounds to process your information which override your rights and freedoms.	acceptable_consent	acceptable_consent	acceptable_consent	
To protect your privacy and security, we take reasonable steps (such as requesting a unique password) to verify your identity before granting you access to your account.	acceptable_consent	acceptable_consent	acceptable_consent	
You also have the right to ask us to delete or remove your personal data where you have successfully exercised your right to object to processing (see below), where we may have processed your information unlawfully or where we are required to erase your personal data to comply with local law.	acceptable_consent	acceptable_consent	acceptable_consent	
Withdraw consent at any time where we are relying on consent to process your personal data.	acceptable_consent	acceptable_consent	acceptable_consent	
You are responsible for taking reasonable precautions to ensure the safety, security, and integrity of your KeepSolid account, transactions, and related access information, and for complying with any security procedures and features available on your device or through KeepSolid that are used to protect your device and KeepSolid account against unauthorized use.	acceptable_consent	acceptable_consent	acceptable_consent	
FREE TRIALS; REFUNDS; DISCOUNTS.	refund	refund	refund	
The binary file is created when you synchronize or back up your data and is kept in order to restore your Content in case of a local system crash, damage, loss, or hack attempt that results in the destruction of your Content.	acceptable_consent	acceptable_consent	acceptable_consent	
You are entirely responsible for safeguarding and maintaining the confidentiality of your username and password and agree not to share your username or password with any person who is not authorized to use your Account.	acceptable_consent	acceptable_consent	acceptable_consent	
Even though Upwork drafted the Terms of Service, you represent that you had ample time to review and decide whether to agree to the Terms of Service.	acceptable_consent	acceptable_consent	acceptable_consent	
If you attempt to terminate this Agreement while having one or more open Projects, you agree (a) you hereby instruct Upwork to close any open contracts; (b) you will continue to be bound by this Agreement and the other Terms of Service until all such Projects have closed on the Site; (c) Upwork will continue to perform those Site Services necessary to complete any open Project or related transaction between you and another User; and (d) you will continue to be obligated to pay any amounts accrued but unpaid as of the date of termination or as of the closure of any open Service Contracts, whichever is later, to Upwork for any Site Services or such other amounts owed under the Terms of Service and to any Freelancers for any Freelancer Services.	acceptable_consent	acceptable_consent	acceptable_consent	
your need to modify practices, content, or behavior or your loss of or inability to do business, as a result of changes to the Terms of Service.	acceptable_consent	acceptable_consent	acceptable_consent	
You are solely responsible for your User Content, including the accuracy of any User Content, and are solely responsible for any legal action that may be instituted by other Users or third parties as a result of or in connection with your User Content if such User Content is legally actionable or defamatory.	acceptable_consent	acceptable_consent	acceptable_consent	
Arbitration of disputes brought by a User that allege a violation of a consumer protection statute also will be subject to the JAMS Consumer Arbitration Minimum Standards, and such arbitrations will be conducted in the same state and within 25 miles of where the User is located.	acceptable_consent	acceptable_consent	acceptable_consent	
, Suite 601, Santa Clara CA 95054 that includes (a) your Account username, (b) your name, (c) your address, (d) your telephone number, (e) your email address, and (f) a statement indicating that you wish to opt out of the Arbitration Provision.	personnal_information	personnal information	personnal_information	
You therefore agree as follows: IF UPWORK DECIDES TO TEMPORARILY OR PERMANENTLY CLOSE YOUR ACCOUNT, UPWORK HAS THE RIGHT WHERE ALLOWED BY LAW BUT NOT THE OBLIGATION TO: (A) NOTIFY OTHER USERS THAT HAVE ENTERED INTO SERVICE CONTRACTS WITH YOU TO INFORM THEM OF YOUR CLOSED ACCOUNT STATUS, (B) PROVIDE THOSE USERS WITH A SUMMARY OF THE REASONS FOR YOUR ACCOUNT CLOSURE.	acceptable_consent	acceptable_consent	acceptable_consent	
If and to the extent any provision of this Agreement or the other Terms of Service is held illegal, invalid, or unenforceable in whole or in part under applicable law, such provision or such portion thereof will be ineffective as to the jurisdiction in which it is illegal, invalid, or unenforceable to the extent of its illegality, invalidity, or unenforceability and will be deemed modified to the extent necessary to conform to applicable law so as to give the maximum effect to the intent of the parties.	acceptable_consent	acceptable_consent	acceptable_consent	
If your account is deactivated or you ask to close your account, you will no longer be able to use the Service.	acceptable_consent	acceptable_consent	acceptable_consent	
Work Diaries include information provided by the Freelancer, such as a memo, as well as automatically gathered information about work on a project, such as number of mouseclicks and keyboard strokes and regularly taken screenshots (which may include a webcam picture of you if you have not disabled this feature in your settings).	acceptable_consent	acceptable_consent	acceptable_consent	
To provide and improve the Service, complete your transactions, address your inquiries, process your registration, verify the information you provide is valid, and for compliance and internal business purposes.	acceptable_consent	acceptable_consent	acceptable_consent	
You do not have a statutory obligation to provide us with any information, but you may have a contractual obligation to do so, and if we do not receive certain information from you, then we will not be able to provide our Service to you.	acceptable_consent	acceptable_consent	acceptable_consent	
This grant includes, but is not limited to, the right to edit the media, the right to use the media (alone or together with other information), and the right to allow others to use or distribute the media.	acceptable_consent	acceptable_consent	acceptable_consent	
All tickets must be assigned to an Attendee, and all Attendee details must be complete within 30 days of receipt of your ticket.	acceptable_consent	acceptable_consent	acceptable_consent	
Notarized letter of consent signed by a legal guardian or both parents (or by a single parent with accompanying proof of sole custody).	acceptable_consent	acceptable_consent	acceptable_consent	
It is a strict condition of these promotions that only individuals 16 to 23 years of age, inclusive, can gain admission to a Conference using these tickets.	acceptable_consent	acceptable_consent	acceptable_consent	
For some ticket types it may be necessary to complete required information such as Attendee name or tax identification number before the tickets can be issued.	acceptable_consent	acceptable_consent	acceptable_consent	
Your ticket remains our property and is a personal revocable license, which may be withdrawn, and admission to a Conference may be refused at any time upon a refund of the printed registration price.	acceptable_consent	acceptable_consent	acceptable_consent	
In certain cases, free or subsidised tickets may be offered within 30 days of the Conference start date.	acceptable_consent	acceptable_consent	acceptable_consent	
De-identified Information: information that has been stripped of your Registration Information (e.g., your name and contact information) and other identifying data such that you cannot reasonably be identified as an individual, also known as pseudonymized information.	acceptable_consent	acceptable_consent	acceptable_consent	
, name, address), before testing personnel receive the samples for processing.	acceptable_consent	acceptable_consent	acceptable_consent	
We may process your Personal Information if you consent to the processing, to satisfy our legal obligations, if it is necessary to carry out our obligations arising from any contracts we entered with you or to take steps at your request prior to entering into a contract with you, or for our legitimate interests to protect our property, rights or safety of 23andMe, our customers or others.	acceptable_consent	acceptable_consent	acceptable_consent	
You have the option to provide us with additional information about yourself through surveys, forms, features and applications.	acceptable_consent	acceptable_consent	acceptable_consent	
If you no longer wish to participate in our Services, or no longer wish to have your Personal Information be processed, you may delete your 23andMe account and Personal Information within your 23andMe Account Settings.	data_management	data management	data_management	
In general you must be a national or international driving license holder,although necessary papers to be eligible to enter the country of destination such as passports and visas are exclusive and depend on every country's border laws and subject to legislation changes.	acceptable_consent	acceptable_consent	acceptable_consent	
If we have made your Personal Information public and we are required to erase such Personal Information, we will take reasonable steps, including technical measures, to inform controllers that are processing any links to or copies or replications of your Personal Information of your erasure request.	acceptable_consent	acceptable_consent	acceptable_consent	
Should you wish to update your sample storage preference to discard a stored sample, you can do so within your 23andMe Account Settings once your sample has completed processing.	acceptable_consent	acceptable_consent	acceptable_consent	
With your consent, we extract your DNA from your saliva sample and analyze it to produce your Genetic Information (the As, Ts, Cs, and Gs at particular locations in your genome) in order to provide you with 23andMe reports.	acceptable_consent	acceptable_consent	acceptable_consent	
Restricted Personal Information shall only be processed with your consent or for the establishment, exercise or defense of legal claims or for the protection of the rights of another natural or legal person or for reasons of important public interest.	acceptable_consent	acceptable_consent	acceptable_consent	
You may withdraw your consent to participate in 23andMe Research at any time by changing your consent status within your 23andMe Account Settings.	acceptable_consent	acceptable_consent	acceptable_consent	
