d	Charles Tag	Categories	Adrien Tag	
If your personal information is relevant to certain products and is freely available through public sources, such as on a website related to your work or profession, we may use this personal information for providing customers with our products, as part of our legitimate interests as a commercial organisation.	sharing_data	sharing data	sharing_data	
The opportunity to opt out of future marketing emails will always be provided, and information on how to do this is given when your personal information is collected and on every marketing email sent.	acceptable_consent	acceptable_consent	acceptable_consent	
The right to obtain your personal data that you have provided to us, on the basis of consent or performance of a contract, and where technically feasible, transmitted in a common electronic format to you or directly to another company.	sharing_data	sharing data	sharing_data	
EBD may choose to display information such as your name, job title, company name, country, a company profile copied or abstracted from company data you have provided (including company address, categories and description), and an indication that you attend and that your company is represented at certain specified events.	sharing_data	sharing data	sharing_data	
We may combine visitor session information, or other information collected through tracking technologies with personally identifiable information, to understand and measure your online experiences and determine what products, promotions and services are likely to be of interest.	non_personnal_information	non personnal information	non_personnal_information	
When you disclose personal information on any public bulletin board or chat areas of this website, or any other website used as a result of use of this website, such personal information can be collected and used by anyone who views that board or area.	sharing_data	sharing data	sharing_data	
In some circumstances, we may be legally required to disclose your personal information, because a court, the police, another judicial or law enforcement body, or government entity has asked us for it.	acceptable_consent	acceptable_consent	acceptable_consent	
If collecting or storing sensitive personal data such as information relating to health, beliefs or political affiliation, we typically ask for your explicit consent.	acceptable_consent	acceptable_consent	acceptable_consent	
Where photos and videos are taken that feature you as an attendee, sponsor or exhibitor, we may use those photos and videos for promotional purposes.	content_licence	content Licence	content_licence	
In some cases, we may be entitled to decline a request you have made regarding your personal information, in accordance with application laws.	personnal_information	personnal information	personnal_information	
A variety of physical and technical measures are used to keep data safe and prevent unauthorised access to, or use or disclosure of personal information.	acceptable_consent	acceptable_consent	acceptable_consent	
The right to confirmation whether or not we have your personal data and, if we do, to obtain a copy of the personal information we hold.	acceptable_consent	acceptable_consent	acceptable_consent	
The right to request the restriction or suppression of personal data.	acceptable_consent	acceptable_consent	acceptable_consent	
We may also continue to retain your personal information to meet our legal requirements or to defend or exercise our legal rights.	acceptable_consent	acceptable_consent	acceptable_consent	
When you upload, submit, store, send or receive content to or through our Services, you give Google (and those we work with) a worldwide license to use, host, store, reproduce, modify, create derivative works (such as those resulting from translations, adaptations or other changes we make so that your content works better with our Services), communicate, publish, publicly perform, publicly display and distribute such content.	content_licence	content Licence	content_licence	
Otherwise, all claims arising out of or relating to these terms or the services will be litigated exclusively in the federal or state courts of Santa Clara County, California, USA, and you and Google consent to personal jurisdiction in those courts.	acceptable_consent	acceptable_consent	acceptable_consent	
This can include information in or about the content you provide (like metadata), such as the location of a photo or the date a file was created.	non_personnal_information	non personnal information	non_personnal_information	
When you delete your account, we delete things you have posted, such as your photos and status updates, and you won't be able to recover that information later.	acceptable_consent	acceptable_consent	acceptable_consent	
If the ownership or control of all or part of our Products or their assets changes, we may transfer your information to the new owner.	sharing_data	sharing data	sharing_data	
You can learn how to access and delete information we collect by visiting the Facebook Settings and Instagram Settings.	acceptable_consent	acceptable_consent	acceptable_consent	
If you use our Products for purchases or other financial transactions (such as when you make a purchase in a game or make a donation), we collect information about the purchase or transaction.	personnal_information	personnal information	personnal_information	
For example, people can share a photo of you in a Story, mention or tag you at a location in a post, or share information about you in their posts or messages.	sharing_data	sharing data	sharing_data	
Network and connections: information such as the name of your mobile operator or ISP, language, time zone, mobile phone number, IP address, connection speed and, in some cases, information about other devices that are nearby or on your network, so we can do things like help you stream a video from your phone to your TV.	non_personnal_information	non personnal information	non_personnal_information	
Data from device settings: information you allow us to receive through device settings you turn on, such as access to your GPS location, camera or photos.	non_personnal_information	non personnal information	non_personnal_information	
Face recognition: If you have it turned on, we use face recognition technology to recognize you in photos, videos and camera experiences.	content_licence	content Licence	content_licence	
This includes your Instagram username; any information you share with a public audience; information in your public profile on Facebook; and content you share on a Facebook Page, public Instagram account or any other public forum, such as Facebook Marketplace.	content_licence	content Licence	content_licence	
By accessing and using MTI, you agree to these Terms and Conditions and our Privacy Policy and you consent to TUI: a) disclosing your personal information to TransUnion to request your credit information and use it to confirm your identity and display your credit information, including your credit report and score; b) periodically requesting and updating your credit information from TransUnion while you have access to MTI; and c) disclosing your information to third party providers of TUCI who will use the information to provide you with additional identity protection services, as are now or in the future offered through MTI.	sharing_data	sharing data	sharing_data	
If you chose to access MTI, you will be required to register, provide personal information and select a user name and password.	personnal_information	personnal information	personnal_information	
In order to deliver MTI to you, we must obtain your credit information and other personal information from TransUnion.	personnal_information	personnal information	personnal_information	
You must have reached the age of majority in your province of residence to access MTI.	acceptable_consent	acceptable_consent	acceptable_consent	
Disqus reserves the right to access, read, preserve, and disclose any information as we reasonably believe is necessary to (i) satisfy applicable law; (ii) enforce these Terms, including investigation of potential violations hereof; (iii) detect, prevent, or otherwise address fraud, security or other technical issues; (iv) respond to user support requests; (v) protect the rights, property or safety of Disqus; (vi) or as otherwise set forth in the Disqus Privacy Policy.	acceptable_consent	acceptable_consent	acceptable_consent	
This license authorizes Disqus to make your User Content available, to the rest of the world and to let others do the same.	content_licence	content Licence	content_licence	
You agree that this license also includes the right for Disqus to provide, promote, and improve the Services and to make User Content submitted to or through the Services available to other companies, organizations or individuals for the syndication, broadcast, distribution, promotion, publication, or otherwise of such User Content on other media and services.	content_licence	content Licence	content_licence	
When creating your account, you must provide accurate and complete information.	personnal_information	personnal information	personnal_information	
The validity, interpretation, performance and enforcement of this Agreement shall be governed by the laws of the State of California and each party irrevocably submits to exclusive jurisdiction and venue in the courts located in Santa Clara County, California.	acceptable_consent	acceptable_consent	acceptable_consent	
In addition to the above, we may access, preserve, and disclose your personal data, including your Identity, Contact, or Technical data, if we believe doing so is required or appropriate to comply with law enforcement requests and legal process, such as a court order, government request, or subpoena, or to meet national security or law enforcement requirements.	acceptable_consent	acceptable_consent	acceptable_consent	
Arbitration hearings shall be held at a place within Bronx County or New York County, New York, and each Party hereby consents to personal jurisdiction in the foregoing forums.	acceptable_consent	acceptable_consent	acceptable_consent	
ARBITRATION REPLACES THE RIGHT TO GO TO COURT, AND YOU THEREFORE AGREE TO WAIVE ANY RIGHT THAT YOU OR KEEPSOLID MIGHT OTHERWISE HAVE HAD TO A JURY TRIAL OR THE OPPORTUNITY TO LITIGATE ANY CLAIMS IN COURT BEFORE EITHER A JUDGE OR JURY.	acceptable_consent	acceptable_consent	acceptable_consent	
YOU FURTHER AGREE THAT YOU WILL NOT BE ABLE TO BRING A CLASS ACTION OR OTHER REPRESENTATIVE ACTION (SUCH AS AN ACTION IN THE FORM OF A PRIVATE ATTORNEY GENERAL) TO LITIGATE ANY CLAIMS IN COURT BEFORE EITHER A JUDGE OR JURY; NOR WILL YOU BE ABLE TO PARTICIPATE AS A CLASS MEMBER IN A CLASS ACTION OR OTHER REPRESENTATIVE ACTION IN ARBITRATION OR IN COURT BEFORE EITHER A JUDGE OR JURY.	acceptable_consent	acceptable_consent	acceptable_consent	
You will ensure that any and all information that you provide to KeepSolid is true, accurate, and correct, and you will provide KeepSolid with updated information, including, without limitation, your name and email address, immediately upon any changes to such information.	personnal_information	personnal information	personnal_information	
You may not remove: (i) more than one (1) device per each 7-day period; or (ii) any devices during the first 7-day period after the beginning of your Subscription.	enrollment	enrollment	enrollment	
You agree not to provide any false or misleading information about your identity or location, your business, your skills, or the services your business provides and to correct any such information that is or becomes false or misleading.	personnal_information	personnal information	personnal_information	
You agree to provide true, accurate, and complete information on your Profile and all registration and other forms you access on the Site or provide to us and to update your information to maintain its truthfulness, accuracy, and completeness.	personnal_information	personnal information	personnal_information	
When requested, you must timely provide us with complete information about yourself and your business, which includes, but is not limited to, providing official government or legal documents.	personnal_information	personnal information	personnal_information	
Without limitation, Users are solely responsible for (a) ensuring the accuracy and legality of any User Content, (b) determining the suitability of other Users for a Service Contract (such as any interviews, vetting, background checks, or similar actions), (c) negotiating, agreeing to, and executing any terms or conditions of Service Contracts, (d) performing Freelancer Services, or (e) paying for Service Contracts or Freelancer Services.	acceptable_consent	acceptable_consent	acceptable_consent	
(iv) provided, however, that if the amount in (ii) and (iii) cannot be ascertained due to uncertainty or lack of sufficient information, then Upwork and you agree that fee shall be $3,500; if only one of (ii) or (iii) can be ascertained, then Upwork and you agree that amount shall be used if it is greater than $3,500.	financial_penalties	financial penalties	financial_penalties	
You authorize Upwork, directly or through third parties, to make any inquiries necessary to validate your identity, your location, and confirm your ownership of your email address or financial accounts, subject to applicable law.	personnal_information	personnal information	personnal_information	
Unless you request that we delete certain information (see Your Choices and Rights below), we delete the information you submit to verify your identity after 30 days and we retain other information we collect for at least 5 years.	data_management	data management	data_management	
To enforce and comply with the law, including to conduct an investigation, to protect the property and rights of Upwork or a third party, to protect the safety of the public or any person, or to prevent or stop activity we may consider to be, or to pose a risk of being, illegal, fraudulent, unethical or legally actionable activity.	acceptable_consent	acceptable_consent	acceptable_consent	
If you are eligible under applicable law to avail of a right to cancel your purchase of a ticket within 14 days without giving any reason and to receive a reimbursement of payments, you need to notify us in writing of your decision to cancel your Conferences ticket within 14 days of the day the contract for distance selling was concluded.	enrollment	enrollment	enrollment	
In certain situations, 23andMe may be required to disclose Personal Information in response to lawful requests by public authorities, including to meet national security or law enforcement requirements.	acceptable_consent	acceptable_consent	acceptable_consent	
Under certain circumstances your Personal Information may be subject to processing pursuant to laws, regulations, judicial or other government subpoenas, warrants, or orders.	acceptable_consent	acceptable_consent	acceptable_consent	
Before you disclose information about a family member, you should make sure you have permission from the family member to do so.	acceptable_consent	acceptable_consent	acceptable_consent	
23andMe will preserve and disclose any and all information to law enforcement agencies or others if required to do so by law or in the good faith belief that such preservation or disclosure is reasonably necessary to: (a) comply with legal or regulatory process (such as a judicial proceeding, court order, or government inquiry) or obligations that 23andMe may owe pursuant to ethical and other professional rules, laws, and regulations; (b) enforce the 23andMe Terms of Service and other policies; (c) respond to claims that any content violates the rights of third parties; or (d) protect the rights, property, or personal safety of 23andMe, its employees, its users, its clients, and the public.	acceptable_consent	acceptable_consent	acceptable_consent	
name, email, address, user ID and password, and payment information).	personnal_information	personnal information	personnal_information	
, your profile picture, network, gender, username, user ID, age range, language, country, friends lists or followers) depending on your privacy settings on the third party site.	personnal_information	personnal information	personnal_information	
Personal Information: information that can be used to identify you, either alone or in combination with other information.	personnal_information	personnal information	personnal_information	
We will not provide information to law enforcement or regulatory authorities unless required by law to comply with a valid court order, subpoena, or search warrant for genetic or Personal Information (visit our Transparency Report).	acceptable_consent	acceptable_consent	acceptable_consent	
Permission to use your name, profile picture, and information about your actions with ads and sponsored content: You give us permission to use your name and profile picture and information about actions you have taken on Facebook next to or in connection with ads, offers, and other sponsored content that we display across our Products, without any compensation to you.	sharing_data	sharing data	sharing_data	
Your contact information so that we can reply to your complaint, preferably including your name, address, email address and telephone number.	personnal_information	personnal information	personnal_information	
You must provide your legal full name, a valid email address, and any other information requested in order to complete the signup process.	personnal_information	personnal information	personnal_information	
The Services are available only to individuals who are at least 16 years old.	acceptable_consent	acceptable_consent	acceptable_consent	
By using any of the Services, you warrant that you are at least 16 years of age.	acceptable_consent	acceptable_consent	acceptable_consent	
We may also release your information when we believe release is appropriate to comply with the law, enforce our site policies, or protect ours or others' rights, property, or safety.	acceptable_consent	acceptable_consent	acceptable_consent	
We collect personal information, such as your name and email address, when you register for an account on the Service.	personnal_information	personnal information	personnal_information	
Please note: In order to verify your identity, we may require you to provide us with personal information prior to accessing any records containing information about you.	personnal_information	personnal information	personnal_information	
You must pay it as you formalize the reserve of the vehicle.	acceptable_consent	acceptable_consent	acceptable_consent	
This insurance is only valid in the country of destination during the rent period.	unknown_extra_cost	unknown extra cost	unknown_extra_cost	
You understand that your content, may be transferred unencrypted and involve (a) transmissions over various networks; and (b) changes to conform and adapt to technical requirements of connecting networks or devices.	sharing_data	sharing data	sharing_data	
Account registration requires you to submit to Uber certain personal information, such as your name, address, mobile phone number and age, as well as at least one valid payment method supported by Uber.	personnal_information	personnal information	personnal_information	
You represent and warrant that: (i) you either are the sole and exclusive owner of all User Content or you have all rights, licenses, consents and releases necessary to grant Uber the license to the User Content as set forth above; and (ii) neither the User Content, nor your submission, uploading, publishing or otherwise making available of such User Content, nor Uber's use of the User Content as permitted herein will infringe, misappropriate or violate a third party's intellectual property or proprietary rights, or rights of publicity or privacy, or result in the violation of any applicable law or regulation.	content_licence	content Licence	content_licence	
If Uber changes these Terms after the date you first agreed to the Terms (or to any subsequent changes to these Terms), you may reject any such change by providing Uber written notice of such rejection within 30 days of the date such change became effective, as indicated in the "Effective" date above.	acceptable_consent	acceptable_consent	acceptable_consent	
You agree that this license includes the right for Twitter to provide, promote, and improve the Services and to make Content submitted to or through the Services available to other companies, organizations or individuals for the syndication, broadcast, distribution, promotion or publication of such Content on other media and services, subject to our terms and conditions for such Content use.	content_licence	content Licence	content_licence	
We also reserve the right to access, read, preserve, and disclose any information as we reasonably believe is necessary to (i) satisfy any applicable law, regulation, legal process or governmental request, (ii) enforce the Terms, including investigation of potential violations hereof, (iii) detect, prevent, or otherwise address fraud, security or technical issues, (iv) respond to user support requests, or (v) protect the rights, property or safety of Twitter, its users and the public.	acceptable_consent	acceptable_consent	acceptable_consent	
You expressly consent and agree to submit to the exclusive jurisdiction and venue in Connecticut, in each case located in the City of New Haven, County of New Haven, Connecticut, although we retain the right to bring any suit, action or proceeding against you for breach of these Terms of Use in your country of residence or any other relevant country.	acceptable_consent	acceptable_consent	acceptable_consent	
These Terms set forth the entire, final and exclusive agreement between Edible Arrangements, LLC and you with respect to your use of, and access to, the Website and any and all content, data, information and materials contained therein and transactions completed thereon, and supersede all previous oral and written terms, representations, or understandings concerning your use of, and access to, the Website and any and all content, data, information and materials contained therein and transactions completed thereon.	acceptable_consent	acceptable_consent	acceptable_consent	
If the agreement to arbitrate is found not to apply to you or your claim, you agree to the exclusive jurisdiction of the state and federal courts in Connecticut to resolve your claim.	acceptable_consent	acceptable_consent	acceptable_consent	
Edible Arrangements, LLC also reserves the right at all times to disclose any information as Edible Arrangements, LLC deems necessary to satisfy any applicable law, regulation, legal process or governmental request, or to edit, refuse to post or to remove any information or materials, in whole or in part, in Edible Arrangements, LLC sole discretion.	acceptable_consent	acceptable_consent	acceptable_consent	
You agree that the information You provide to Manulife in connection with registering to use the Sites and at all other times will be true, accurate, current and complete and will ensure that this information is kept accurate and up to date at all times.	personnal_information	personnal information	personnal_information	
Manulife shall adhere to applicable laws regarding privacy and the protection of personal information, and shall maintain appropriate administrative, technical and physical measures to safeguard and secure Your personal information.	acceptable_consent	acceptable_consent	acceptable_consent	
When You register to use the Sites, You will be asked to provide Your email address ('Login name') and a password.	personnal_information	personnal information	personnal_information	
You and Apple agree to submit to the personal and exclusive jurisdiction of the courts located within the county of Santa Clara, California, to resolve any dispute or claim arising from this Agreement.	acceptable_consent	acceptable_consent	acceptable_consent	
Thus, for any actions not subject to arbitration, you and Eventbrite agree to submit to the personal jurisdiction of the federal or state courts (as applicable) located in San Francisco County, California.	acceptable_consent	acceptable_consent	acceptable_consent	
We may disclose your Personal Data if required to do so by law in order to (for example) respond to a subpoena or request from law enforcement, a court or a government agency (including in response to public authorities to meet national security or law enforcement requirements), or in the good faith belief that such action is necessary to (a) comply with a legal obligation, (b) protect or defend our rights, interests or property or that of third parties, (c) prevent or investigate possible wrongdoing in connection with the Services, (d) act in urgent circumstances to protect the personal safety of Users of the Services or the public, or (e) protect against legal liability.	acceptable_consent	acceptable_consent	acceptable_consent	
Information you provide to us: For all Users we collect Personal Data when you voluntarily provide such information to the Services, such as when you register for access to the Services, contact us with inquiries, respond to one of our surveys or browse or use certain parts of the Services.	personnal_information	personnal information	personnal_information	
For instance, if you supply Personal Data relating to your identity or qualifications to use certain portions of the Services, we will use that information to make a decision as to granting you access to use such Services and to assess your ongoing qualification to use such Services.	personnal_information	personnal information	personnal_information	
