d	Charles Tag	Categories	Adrien Tag	
THE TECHSTARS ENTITIES’ MAXIMUM AGGREGATE LIABILITY TO YOU FOR LOSSES OR DAMAGES THAT YOU SUFFER IN CONNECTION WITH OUR SERVICES OR THESE TERMS IS LIMITED TO THE GREATER OF (i) THE AMOUNT PAID, IF ANY, BY YOU TO THE TECHSTARS ENTITIES IN CONNECTION WITH OUR SERVICES IN THE 12 MONTHS PRIOR TO THE ACTION GIVING RISE TO LIABILITY, OR (ii) $100	acceptable_consent	acceptable_consent	acceptable_consent	
We do not store your credit card information	acceptable_consent	acceptable_consent	acceptable_consent	
Unless required to do so by law, we will not otherwise share, sell or distribute any of the information you provide to us without your consent.	acceptable_consent	acceptable_consent	acceptable_consent	
Shipping method: UPS – 3 $ / 0.5 Lbs	financial_penalties	financial penalties	financial_penalties	
We will not share your phone number(s) with third parties for their own purposes without your consent.	acceptable_consent	acceptable_consent	acceptable_consent	
Where the relief sought is $25,000 or less, the arbitration will be conducted by FairClaims in accordance with its Arbitration Rules & Procedures effective at the time a claim is made.	acceptable_consent	acceptable_consent	acceptable_consent	
Visitors may post reviews, comments, photos, and other content;	acceptable_consent	acceptable_consent	acceptable_consent	
You agree that L'ANCEE PERFECTOR entire liability for all CLAIMS shall be limited, in the aggregate, to the lesser of (i) USD $500.00, or (ii) the total amount of money You paid to L'ANCEE PERFECTOR in the one (1) month period immediately preceding the incident on which Your alleged claim is based.	acceptable_consent	acceptable_consent	acceptable_consent	
acts of Nature, such as fire, flood, earthquakes, hurricanes, tropical storms or other natural disasters;	acceptable_consent	acceptable_consent	acceptable_consent	
No license or ownership rights in or to any of the Intellectual Property are conveyed to you by virtue of this Agreement or by your purchase of any Product from the Website.	acceptable_consent	acceptable_consent	acceptable_consent	
or (b) the equivalent court filing fees for a court action in the appropriate jurisdiction if you are seeking $1,000 or more from us.	acceptable_consent	acceptable_consent	acceptable_consent	
Your profile and all Content (recipes, images, feedback, and other information) added to your account remain yours.	acceptable_consent	acceptable_consent	acceptable_consent	
You agree any action at law or in equity arising out of or relating to these terms and conditions shall be filed only in the state and federal courts residing in Larimer County, Colorado, and you hereby irrevocably and unconditionally consent and submit to the exclusive jurisdiction of such courts over any suit, action, or proceeding arising out of this Notice.	acceptable_consent	acceptable_consent	acceptable_consent	
L'ANCEE PERFECTOR reserves the right to terminate this Agreement without notice and/or refuse to sell to anyone who L'ANCEE PERFECTOR believes, in Our sole discretion, (i) has violated any of the terms of this Agreement, (ii) is abusing the Products or the services Your L'ANCEE PERFECTOR provides, or (iii) is unable to provide Us with sufficient information to allow Us to properly identify the customer’s real name, address, or other contact information.	acceptable_consent	acceptable_consent	acceptable_consent	
You may post reviews, comments, photos, videos, and other content;	acceptable_consent	acceptable_consent	acceptable_consent	
We never share with subscribers the Commercial Messages or any data that contains personal information, such as your email address, IP address, name, photo, phone numbers, postal addresses (for example, if it is included in your shipping information).	acceptable_consent	acceptable_consent	acceptable_consent	
(4) Request erasure of your personal information;	acceptable_consent	acceptable_consent	acceptable_consent	
We use cookies to enable advertising with our third-party Partners	sharing_data	sharing data	sharing_data	
We share this information with certain third-parties (e.g., talent recruiters, payment processors, and advertising providers)	sharing_data	sharing data	sharing_data	
Stack Overflow reserves the right to assign our rights and obligations under these Public Network Terms (in whole or in part) without your consent to a corporate affiliate, or in connection with a merger, acquisition, corporate restructure or reorganization, or due to the sale of all or substantially all of our assets.	sharing_data	sharing data	sharing_data	
any content or information you share publicly is governed by the terms described below in the section titled "Public Content Permissions, Restrictions, and Creative Commons Licensing," and you should be aware that once you place content in the public sphere, you willingly give up some rights and control over such content	content_licence	content Licence	content_licence	
Stack Overflow receives and records information from your browser or mobile device when you visit the Network or use the Apps, such as your Internet Protocol (IP) address or unique device identifier.	non_personnal_information	non personnal information	non_personnal_information	
This information is used to keep the Products and Services secure, analyze and understand how our Products and Services are used, optimize such usage, provide advertising across the Network as well as certain Products and Services to personalize your experience, and to help connect you with potential job opportunities in the case of our recruiting Products and Services	sharing_data	sharing data	sharing_data	
Stack Overflow and its third party partners may collect and use your personal information to tailor your advertising experience	sharing_data	sharing data	sharing_data	
We may also share your personal data as part of a sale, merger or change in control of SoundCloud, or in preparation for any of these events. Any other entity that buys us or part of our business will have the right to continue to use your data, but only in the manner set out in this Privacy Policy unless you agree otherwise.	sharing_data	sharing data	sharing_data	
You agree to indemnify SoundCloud from all claims resulting from any third party for infringement of copyright or invastion of privacy related to your content or any activity related to your account.	content_licence	content Licence	content_licence	
We share the data collected about you, generally in hashed, aggregated, or de-identified forms with advertisers and advertising service providers and business partners in order to serve ads based on your interests and measure the reach and effectiveness of those ads, including whether a user took an action (e.g. purchase a product).	sharing_data	sharing data	sharing_data	
You will defend, indemnify and hold harmless us (and our Affiliates, officers, directors, agents and employees) from and against any and all claims, costs, damages, losses, liabilities and expenses (including reasonable attorneys’ fees and costs) resulting from any claim arising from or related to (i) your breach of Section 2.3 (End User Consent) or any claims or disputes brought by your End Users arising out of their use of Cloud Products, (ii) your breach (or alleged breach) of Sections 5.2 (Your Data Compliance Obligations) or 5.3 (No Sensitive Data). or (iii) Your Materials.	acceptable_consent	acceptable_consent	acceptable_consent	
According to ToS users are not involved in changes, they will be just "notified".	acceptable_consent	acceptable_consent	acceptable_consent	
We use the locational data in order to give you a better Ecosia experience or to show more relevant search results or advertising to you.	non_personnal_information	non personnal information	non_personnal_information	
Ecosia allows third-party providers to set cookies in order to check the success of Ecosia advertising campaigns.	sharing_data	sharing data	sharing_data	
When you register via the login details of a third-party provider, the provider will also process your personal data. however, we will not have access to this information. Information collected by the commenting function is made available to us via Disqus.	sharing_data	sharing data	sharing_data	
JetBrains reserves the right, at its sole discretion, to change, add, or remove any part of these Terms of Use at any time without prior notice to you.	redflag	red-flag	redflag	
data collected by cookies or other tracking technologies (incl. clear GIFs, pixel tags and other technologies and third-party cookies) will be used	non_personnal_information	non personnal information	non_personnal_information	
You will not use false identity information when registering for subscriptions, downloads, or product licenses.	personnal_information	personnal information	personnal_information	
In the event that we sell or buy any business or assets, in which case we will disclose your personal data to the prospective seller or buyer of such business or assets.If Canonical or substantially all of its assets are acquired by a third party, in which case personal data held by it about its customers will be one of the transferred assets.	sharing_data	sharing data	sharing_data	
500px reserves the right, at its sole discretion, to modify or replace the Terms at any time.	redflag	red-flag	redflag	
By posting Visual Content to the Site, you grant to 500px a non-exclusive or exclusive, transferable, fully paid, worldwide license to use, sublicense, distribute, reproduce, modify, adapt, publicly perform and publicly display such Visual Content in connection with the Services	content_licence	content Licence	content_licence	
The license granted to 500px includes the right to use Visual Content fully or partially for promotional reasons and to distribute and redistribute Visual Content to other parties, websites, authorized agents, applications, and other entities, provided such Visual Content is attributed in accordance with the required credits	content_licence	content Licence	content_licence	
The use of our Services imply your approval of the present terms. 	acceptable_consent	acceptable_consent	acceptable_consent	
Upon a request by Ryver, you agree to defend, indemnify, and hold harmless the Ryver Group from all liabilities, claims, and expenses, including reasonable attorneys’ fees, that arise from your use of the Service in a manner not in strict conformance with these Terms.	acceptable_consent	acceptable_consent	acceptable_consent	
As we develop our business, we may buy or sell assets or business offerings. Customers, email, and visitor information is generally one of the business assets transferred in these types of transactions. We may also transfer or assign such information in the course of corporate divestitures, consolidations, mergers, or dissolution.	sharing_data	sharing data	sharing_data	
Ryver may share your personally identifiable information or certain content with other third parties for the purpose of providing the Service to you	sharing_data	sharing data	sharing_data	
Signal may update the Terms from time to time. 	acceptable_consent	acceptable_consent	acceptable_consent	
Because our services are used by people all over the world, personal information that we collect may be stored and processed in the United States of America or any other country in which we or our agents maintain facilities	data_management	data management	data_management	
By submitting user content to reddit, you grant us a royalty-free, perpetual, irrevocable, non-exclusive, unrestricted, worldwide license to reproduce, prepare derivative works, distribute copies, perform, or publicly display your user content in any medium and for any purpose, including commercial purposes, and to authorize others to do so.	content_licence	content Licence	content_licence	
We may receive information about you from other sources, including from other users and third parties, and combine that information with the other information we have about you. For example, we may receive demographic or interest information about you from third parties, including advertisers, and combine it with our own data using a common account identifier such as a hash of an email address or a mobile-device ID.	sharing_data	sharing data	sharing_data	
We may partner with third-party advertisers, ad networks, and analytics providers to deliver advertising and content targeted to your interests and to better understand your use of the Services. 	acceptable_consent	acceptable_consent	acceptable_consent	
Except as otherwise provided in the specific Oath product terms or guidelines for a Service, when you upload, share with or submit content to the Services you retain ownership of any intellectual property rights that you hold in that content and you grant Oath a worldwide, royalty-free, non-exclusive, perpetual, irrevocable, transferable, sublicensable license to (a) use, host, store, reproduce, modify, prepare derivative works (such as translations, adaptations, summaries or other changes), communicate, publish, publicly perform, publicly display, and distribute this content in any manner, mode of delivery or media now known or developed in the future and (b) permit other users to access, reproduce, distribute, publicly display, prepare derivative works of, and publicly perform your content via the Services, as may be permitted by the functionality of those Services (e.g., for users to re-blog, re-post or download your content).	content_licence	content Licence	content_licence	
"We may [...] set and access device identifiers which could include [...] user agent information (browser version, OS type and version)"	personnal_information	personnal information	personnal_information	
Netflix may, from time to time, change these Terms of Use. 	redflag	red-flag	redflag	
We also use cookies, as well as advertising identifiers, to learn more about our users and their likely interests, and to deliver and tailor marketing or advertising.	non_personnal_information	non personnal information	non_personnal_information	
We reserve the right to modify the terms at any time so they can fit the evolutions of the services of QWANT and/or their operation.	acceptable_consent	acceptable_consent	acceptable_consent	
When we update our Terms, we will update the “Last Modified” date associated with the updated Terms. 	acceptable_consent	acceptable_consent	acceptable_consent	
Your continued use of our Services confirms your acceptance of our updated Terms and supersedes any prior Terms.	acceptable_consent	acceptable_consent	acceptable_consent	
You will comply with all applicable export control and trade sanctions laws. 	unknown_extra_cost	unknown extra cost	unknown_extra_cost	
Our Terms cover the entire agreement between you and Signal regarding our Services. 	acceptable_consent	acceptable_consent	acceptable_consent	
If you do not agree with our Terms, you should stop using our Services.	acceptable_consent	acceptable_consent	acceptable_consent	
These third parties may collect information sent by your computer, browser, or mobile device in response to a request for content, such as unique identifiers, your IP address, or other information about your computer or device.	non_personnal_information	non personnal information	non_personnal_information	
Imgur allows users to send messages to one another both indirectly (via comments to posts) and directly (via chat). 	acceptable_consent	acceptable_consent	acceptable_consent	
We may revise our privacy policy from time to time by posting the changes here. 	redflag	red-flag	redflag	
Our servers log information about each computer connecting with our site such as IP address, dates and times of each login, device characteristics, operating system, browser type, type of connection, page and image viewing statistics, and incoming and outgoing links.	non_personnal_information	non personnal information	non_personnal_information	
For legal reasons we may retain backup and/or archival copies of information prior to your corrections, amendments, or deletions	content_licence	content Licence	content_licence	
we collect location data using Global Navigation Satellite System (GNSS) (e.g., GPS) and data about nearby cell towers and Wi-Fi hotspots. 	non_personnal_information	non personnal information	non_personnal_information	
The data we collect can include the following:Name and contact data. 	personnal_information	personnal information	personnal_information	
In addition, IP address, device identifiers (such as the IMEI number for phones), regional and language settings, and information about WLAN access points near your device.	non_personnal_information	non personnal information	non_personnal_information	
Finally, we will retain, access, transfer, disclose, and preserve personal data, including your content (such as the content of your emails in Outlook.com, or files in private folders on OneDrive),	personnal_information	personnal information	personnal_information	
Additionally, Microsoft partners with third-party ad companies to help provide some of our advertising services, and we also allow other third-party ad companies to display advertisements on our sites. These third parties may place cookies on your computer and collect data about your online activities across websites or online services.	sharing_data	sharing data	sharing_data	
We may also disclose personal data as part of a corporate transaction such as a merger or sale of assets.	sharing_data	sharing data	sharing_data	
Personal data collected by Microsoft may be stored and processed in your region, in the United States, and in any other country where Microsoft or its affiliates, subsidiaries, or service providers operate facilities. Microsoft maintains major data centers in Australia, Austria, Brazil, Canada, Chile, Finland, France, Germany, Hong Kong, India, Ireland, Japan, Korea, Luxembourg, Malaysia, the Netherlands, Singapore, South Africa, the United Kingdom, and the United States.	data_management	data management	data_management	
We transfer personal data from the European Economic Area and Switzerland to other countries, some of which have not yet been determined by the European Commission to have an adequate level of data protection.	data_management	data management	data_management	
the storage location(s) are chosen in order to operate efficiently, to improve performance, and to create redundancies in order to protect the data in the event of an outage or other problem.	acceptable_consent	acceptable_consent	acceptable_consent	
Deleting your Account may not fully remove the content you have published from our systems, as caching of, backups of, copies of, or references to your Account Information may not be immediately removed. 	data_management	data management	data_management	
Apple and our partners and licensees may collect, use, and share precise location data, including the real-time geographic location of your Apple computer or device. Where available, location-based services may use GPS, Bluetooth, and your IP Address, along with crowd-sourced Wi-Fi hotspot and cell tower locations, and other technologies to determine your devices’ approximate location.	sharing_data	sharing data	sharing_data	
Unless you provide consent, this location data is collected anonymously in a form that does not personally identify you and is used by Apple and our partners and licensees to provide and improve location-based products and services.	non_personnal_information	non personnal information	non_personnal_information	
Our operations are supported by a network of computers, cloud-based servers, and other infrastructure and information technology, including, but not limited to, third-party service providers.	acceptable_consent	acceptable_consent	acceptable_consent	
To operate our global Service, we need to store and distribute content and information in data centers and systems around the world, including outside your country of residence. 	data_management	data management	data_management	
We also collect information about the interaction of your apps, browsers, and devices with our services, including IP address, crash reports, system activity, and the date, time, and referrer URL of your request.	non_personnal_information	non personnal information	non_personnal_information	
By using our products or services, you authorize us to transfer and store your information outside your home country, including in the United States,	data_management	data management	data_management	
We [..] may use automated means to collect [...] network or Internet protocol address and type of browser you are using (e.g., Chrome, Safari, Firefox, Internet Explorer), the type of operating system you are using, (e.g., Microsoft Windows or Mac OS), the name of your Internet service provider (e.g., Comcast, Verizon or AT&T) [...], device settings, browser settings, the web pages of the Services you have visited, Services visited before and after you visit a Service, the type of handheld or mobile device used to view the Service (e.g., iOS, Android), location information, and the content and advertisements you have accessed, seen, forwarded and/or clicked on.	non_personnal_information	non personnal information	non_personnal_information	
You grant NYT a perpetual, nonexclusive, world-wide, royalty-free, sub-licensable license to the Submissions, which includes without limitation the right for NYT, or any third party it designates, to use, copy, transmit, excerpt, publish, distribute, publicly display, publicly perform, communicate to the public, create derivative works of, host, index, cache, tag, encode, modify and adapt (including without limitation the right to adapt to streaming, downloading, broadcast, mobile, digital, thumbnail, scanning or other technologies) in any form or media now known or hereinafter developed, any Submission posted by you on or to the Services or any other website owned by NYT, including any Submission posted on or to the Services through a third party.	content_licence	content Licence	content_licence	
Some of the services and advertisements included in the NYT Services, including on NYTimes.com and within our mobile apps, are delivered or served by third-party companies, which may collect information about your use of the NYT Services.These companies place or recognize cookies, pixel tags, web beacons or other technology to track certain information about our NYT Services website users. For example, in the course of serving certain advertisements, an advertiser may place or recognize a unique cookie on your browser in order to collect certain information about your use of the NYT Services.	sharing_data	sharing data	sharing_data	
We reserve the right to update or modify the Terms at any time without prior notice.	redflag	red-flag	redflag	
When you post or otherwise transmit comments or messages on Roblox via community features such as public chat or private chat, forums, group walls, personal posts, etc. we may collect these comments and messages, and they may be monitored, filtered and moderated for purposes such as removal of profanity, personal data, and other inappropriate conversations.	personnal_information	personnal information	personnal_information	
non-exclusive license to use, online and offline, whatever you create or in the past have created while using the Service.	content_licence	content Licence	content_licence	
Analytics services (e.g., Google Inc, comScore, Flurry Analytics);Advertising services (e.g., AppsFlyer);Community filtering and moderation services (e.g., CommunitySift);Customer support services (e.g., Zendesk);Surveys and promotions (e.g., Magid);Billing services and payment gateway providers (e.g., Kount, SiftScience, PayPal, Vantiv, Incomm, Rixty, Google, Apple, Amazon, Windows Store). andHosting and content delivery network services (e.g., AWS, Equinix, CenturyLink).	sharing_data	sharing data	sharing_data	
these third party advertising companies may use such information and information about your visits to the Service and other websites and services in order to provide advertisements about goods and services of interest to you, often referred to as behaviorally-targeted or re-targeted advertisements.	sharing_data	sharing data	sharing_data	
If you make suggestions to Vimeo on improving or adding new features to the Vimeo Service, Vimeo shall have the right to use your suggestions without any compensation to you.	content_licence	content Licence	content_licence	
We may store and process all or part of your personal and transactional information, including certain payment information, such as your encrypted bank account and/or routing numbers, in the United States and elsewhere in the world where our facilities or our service providers are located.	data_management	data management	data_management	
Store information that your computer or mobile device provides to us in connection with your use of the Quora Platform such as your browser type, type of computer or mobile device, browser language, IP address, mobile carrier, unique device identifier, location, and requested and referring URLs.	non_personnal_information	non personnal information	non_personnal_information	
As such, we and our service providers may transfer your personal information to, or access it in, jurisdictions (including the United States) that may not provide equivalent levels of data protection as your home jurisdiction. 	data_management	data management	data_management	
