d	Charles Tag	Categories	Adrien Tag	
We need certain permissions from you to provide our services: Permission to use content you create and share	content_licence	content Licence	content_licence	
You give us permission to use your name and profile picture and information about actions you have taken on Facebook next to or in connection with ads, offers, and other sponsored content	content_licence	content Licence	content_licence	
Permission to update software you use or download	acceptable_consent	acceptable_consent	acceptable_consent	
This means, for example, that if you share a photo on Facebook, you give us permission to store, copy, and share it with others	content_licence	content Licence	content_licence	
We need to store and distribute content and data in our data centers and systems around the world	data_management	data management	data_management	
We must collect and use your personal data	personnal_information	personnal information	personnal_information	
We do not control or direct what people and others do or say, and we are not responsible for their actions or conduct	acceptable_consent	acceptable_consent	acceptable_consent	
These Terms do not confer any third-party beneficiary rights	acceptable_consent	acceptable_consent	acceptable_consent	
We may also disable your account if you repeatedly infringe other people's intellectual property rights	acceptable_consent	acceptable_consent	acceptable_consent	
You own the content you create and share on Facebook and the other Facebook Products you use, and nothing in these Terms takes away the rights you have to your own content	acceptable_consent	acceptable_consent	acceptable_consent	
To provide the Facebook Products, we must process information about you.	acceptable_consent	acceptable_consent	acceptable_consent	
If you download or use our software, you give us permission to download and install upgrades, updates, and additional features to improve, enhance, and further develop it	acceptable_consent	acceptable_consent	acceptable_consent	
we collect information about the purchase or transaction	non_personnal_information	non personnal information	non_personnal_information	
This includes payment information, such as your credit or debit card number and other card information; other account and authentication information; and billing, shipping and contact details.	personnal_information	personnal information	personnal_information	
We collect information about how you use our Products, such as the types of content you view or engage with	non_personnal_information	non personnal information	non_personnal_information	
we log when you're using and have last used our Products	acceptable_consent	acceptable_consent	acceptable_consent	
We use the information we have to deliver our Products, including to personalize features and content	acceptable_consent	acceptable_consent	acceptable_consent	
We use location-related information-such as your current location, where you live, the places you like to go, and the businesses and people you're near	non_personnal_information	non personnal information	non_personnal_information	
we use face recognition technology to recognize you in photos, videos and camera experiences	personnal_information	personnal information	personnal_information	
We use the information we have to send you marketing communications, communicate with you about our Products, and let you know about our policies and terms.	acceptable_consent	acceptable_consent	acceptable_consent	
We will not provide any compensation for Your participation and Your participation may be suspended at any time	acceptable_consent	acceptable_consent	acceptable_consent	
You understand and agree that your participation in the applicable Program is completely voluntary	acceptable_consent	acceptable_consent	acceptable_consent	
we build systems that try to understand who and what you and others care about	acceptable_consent	acceptable_consent	acceptable_consent	
we use that information to help you create, find, join, and share in experiences that matter to you	acceptable_consent	acceptable_consent	acceptable_consent	
we are using cutting-edge technologies that help us personalize, protect, and improve our Service	acceptable_consent	acceptable_consent	acceptable_consent	
we must store and transfer data across our systems around the world, including outside of your country of residence.	data_management	data management	data_management	
We use data from Instagram and other Facebook Company Products, as well as from third-party partners, to show you ads, offers, and other sponsored content that we believe will be meaningful to you	acceptable_consent	acceptable_consent	acceptable_consent	
Providing our Service requires collecting and using your information	personnal_information	personnal information	personnal_information	
We do not claim ownership of your content, but you grant us a license to use it	content_licence	content Licence	content_licence	
you hereby grant to us a non-exclusive, royalty-free, transferable, sub-licensable, worldwide license to host, use, distribute, modify, run, copy, publicly perform or display, translate, and create derivative works of your content	content_licence	content Licence	content_licence	
Our responsibility for anything that happens on the Service (also called "liability") is limited as much as the law will allow.	acceptable_consent	acceptable_consent	acceptable_consent	
You agree that we won't be responsible ("liable") for any lost profits, revenues, information, or data, or consequential, special, indirect, exemplary, punitive, or incidental damages arising out of or related to these Terms, even if we know they are possible.	acceptable_consent	acceptable_consent	acceptable_consent	
If you agree to pay the Host, or Airbnb determines in its sole discretion that you are responsible for the Damage Claim, Airbnb via Airbnb Payments will, after the end of your stay, collect any such sums from you and/or against the Security Deposit (if applicable) required to cover the Damage Claim pursuant to the Payments Terms.	levy_automatic	levy automatic	levy_automatic	
you are responsible for your own acts and omissions and are also responsible for the acts and omissions of any individuals whom you invite	acceptable_consent	acceptable_consent	acceptable_consent	
Members agree to cooperate with and assist in good faith	acceptable_consent	acceptable_consent	acceptable_consent	
A Member shall, upon reasonable request and at no cost to the Member, participate in mediation or a similar resolution process	acceptable_consent	acceptable_consent	acceptable_consent	
This Privacy Policy describes how we collect, use, process, and disclose your information, including personal information, in conjunction with your access to and use of the Platform	acceptable_consent	acceptable_consent	acceptable_consent	
We ask for and collect the following personal information about you	personnal_information	personnal information	personnal_information	
we require certain information such as your first name, last name, email address, and date of birth	personnal_information	personnal information	personnal_information	
we may ask you to provide additional information, which may include your address, phone number, and a profile picture	personnal_information	personnal information	personnal_information	
we may collect identity verification information (such as images of your government issued ID, passport, national ID card, or driving license, as permitted by applicable laws) or other authentication information	personnal_information	personnal information	personnal_information	
we may require you to provide certain financial information (like your bank account or credit card information)	personnal_information	personnal information	personnal_information	
we collect information about your communication and any information you choose to provide	acceptable_consent	acceptable_consent	acceptable_consent	
Some of this information as indicated in your Account settings is part of your public profile page, and will be publicly visible to others.	sharing_data	sharing data	sharing_data	
the Payments Data Controller requires certain financial information (like your bank account or credit card information) in order to process payments and comply with applicable law	personnal_information	personnal information	personnal_information	
the Payments Data Controller may require identity verification information (such as images of your government issued ID, passport, national ID card, or driving license) or other authentication information, your date of birth, your address, email address, phone number and other information in order to verify your identity	personnal_information	personnal information	personnal_information	
When you use the Airbnb Platform and the Payment Services, we automatically collect information, including personal information, about the services you use and how you use them.	personnal_information	personnal information	personnal_information	
we may collect information about your precise or approximate location as determined through data such as your IP address or mobile device GPS	non_personnal_information	non personnal information	non_personnal_information	
We collect information about your interactions with the Airbnb Platform such as the pages or content you view, your searches for Listings, bookings you have made, and other actions on the Airbnb Platform.	acceptable_consent	acceptable_consent	acceptable_consent	
We automatically collect log data and device information when you access and use the Airbnb Platform	non_personnal_information	non personnal information	non_personnal_information	
Airbnb collects information related to your payment transactions through the Airbnb Platform, including the payment instrument used, date and time, payment amount, payment instrument expiration date and billing postcode, PayPal email address, IBAN information, your address and other related transaction details	personnal_information	personnal information	personnal_information	
We use, store, and process information, including personal information, about you to provide, understand, improve, and develop the Airbnb Platform	personnal_information	personnal information	personnal_information	
As a Guest, you are responsible for leaving the Accommodation (including any personal or other property located at the Accommodation) in the condition it was in when you arrived.	acceptable_consent	acceptable_consent	acceptable_consent	
Subject to your compliance with these Terms, Airbnb grants you a limited, non-exclusive, non-sublicensable, revocable, non-transferable license to (i) download and use the Application	acceptable_consent	acceptable_consent	acceptable_consent	
By creating, uploading, posting, sending, receiving, storing, or otherwise making available any Member Content on or through the Airbnb Platform, you grant to Airbnb a non-exclusive, worldwide, royalty-free, irrevocable, perpetual (or for the term of the protection), sub-licensable and transferable license to such Member Content to access, use, store, copy, modify, prepare derivative works of, distribute, publish, transmit, stream, broadcast, and otherwise exploit in any manner such Member Content to provide and/or promote the Airbnb Platform, in any media or platform	content_licence	content Licence	content_licence	
You are solely responsible for all Member Content that you make available on or through the Airbnb Platform	acceptable_consent	acceptable_consent	acceptable_consent	
While we may help facilitate the resolution of disputes, Airbnb has no control over and does not guarantee (i) the existence, quality, safety, suitability, or legality of any Listings or Host Services, (ii) the truth or accuracy of any Listing descriptions, Ratings, Reviews, or other Member Content (as defined below), or (iii) the performance or conduct of any Member or third party	acceptable_consent	acceptable_consent	acceptable_consent	
Turo reserves the right, at our sole discretion, to modify our Services or to modify these Terms at any time.	redflag	red-flag	redflag	
Any use of the Services by anyone under 21 is expressly prohibited.	acceptable_consent	acceptable_consent	acceptable_consent	
When you register for an account with us, we require certain personal information to open your account, such as your name, email address, and password.	personnal_information	personnal information	personnal_information	
Turo may in its sole discretion use third party services to verify the information you provide to us and to obtain additional related information and corrections where applicable, and you hereby authorize Turo to request, receive, use, and store such information.	sharing_data	sharing data	sharing_data	
We do not make any representations about, confirm, or endorse the safety or roadworthiness of any vehicles beyond our policies that require vehicle owners to ensure their vehicles are in safe and operable condition, legally registered to be driven on public roads, have a clean (non-salvaged/non-branded/non-washed/non-written off) title, not subject to any applicable safety recalls, and otherwise satisfy our eligibility requirements.	acceptable_consent	acceptable_consent	acceptable_consent	
When you apply to become an Approved Driver or at any time after where Turo reasonably believes there may be an increased level of risk associated with your Turo Account, you provide Turo with written instructions and authorization in accordance with the Fair Credit Reporting Act, applicable consumer reporting laws, or any similar laws to obtain your personal and/or business auto insurance score, credit report and/or conduct a background check, including a criminal background check where permissible under applicable law.	personnal_information	personnal information	personnal_information	
You agree that you will always use your Turo Account and the Services in compliance with these Terms, applicable law, and any other policies and standards provided to you by Turo.	acceptable_consent	acceptable_consent	acceptable_consent	
As a vehicle owner or host, you commit that you will provide a safe and legally registered and insured vehicle, with a clean (non-salvage/branded/written off) title, in good mechanical condition, on time to the traveler or guest who is an Approved Driver	acceptable_consent	acceptable_consent	acceptable_consent	
you agree that you will not, nor advocate, encourage, request, or assist any third party to Violate any law, including: breach, violate, and/or circumvent any local, state, provincial/territorial, regional, or national law or other law or regulation, or any order of a court, including, without limitation, airport regulations and tax regulations, licensing or registration requirements, or third party rights	acceptable_consent	acceptable_consent	acceptable_consent	
Turo may access, preserve, and disclose any of your information if we are permitted or required to do so by law; if we believe in good faith that it is reasonably necessary to respond to claims asserted against Turo or to comply with permissible legal process (for example, subpoenas or warrants); to enforce or administer these Terms; to do so for fraud prevention, risk assessment, investigation, customer support, product development, and debugging purposes; and/or to protect the rights, property, or safety of Turo, its employees, its users, or members of the public.	acceptable_consent	acceptable_consent	acceptable_consent	
Turo has the right, but not the obligation, to investigate, pursue, and seek to prosecute, litigate, or refer to law enforcement, violations of the Agreement to the fullest extent permissible by the law.	acceptable_consent	acceptable_consent	acceptable_consent	
Turo reserves the right, at any time and without prior notice, in accordance with applicable law, to remove or disable access to any content that Turo, at its sole discretion, considers to be objectionable for any reason, in violation of this Agreement, or otherwise harmful to the Services or our community.	acceptable_consent	acceptable_consent	acceptable_consent	
We may choose to be more lenient with policy enforcement in an effort to do the right thing, subject to our sole and absolute discretion.	acceptable_consent	acceptable_consent	acceptable_consent	
When an issue arises, we may consider the user's performance history and the specific circumstances in applying our Policies. 	acceptable_consent	acceptable_consent	acceptable_consent	
In order to contact you more efficiently, you agree that we may at times contact you using autodialed or prerecorded message calls or text messages at your telephone number(s).	acceptable_consent	acceptable_consent	acceptable_consent	
You authorize Turo and its partners, without further notice or warning and in our discretion, to monitor or record telephone conversations you or anyone acting on your behalf has with Turo or its agents for quality control and training purposes. 	personnal_information	personnal information	personnal_information	
You acknowledge and understand that your communications with Turo may be overheard, monitored, or recorded without further notice or warning. If you do not wish to have your call recorded, please contact us instead in writing through support.turo.com.	sharing_data	sharing data	sharing_data	
We may, in our sole discretion, permit you to post, upload, publish, submit or transmit content through our Services such as photographs of you and your vehicle(s), reviews, feedback, and descriptions of you, your vehicle or trip.	acceptable_consent	acceptable_consent	acceptable_consent	
By making available any content on or through the Services, or through Turo promotional campaigns, you grant Turo a worldwide, irrevocable, perpetual (or for the term of the protection), non-exclusive, transferable, royalty-free license, with the right to sublicense, to use, view, copy, adapt, modify, distribute, transfer, publicly display, publicly perform, transmit, stream, broadcast, access, view, and otherwise exploit such content on, through, by means of, or to promote or market the Services.	content_licence	content Licence	content_licence	
You may discontinue your use of the Services at any time and Turo may terminate your access to the Services and remove any listings for any reason or no reason to the extent permissible under applicable law.	acceptable_consent	acceptable_consent	acceptable_consent	
To the extent permitted by applicable law, you agree to release, defend, indemnify, and hold Turo and its subsidiaries, officers, directors, employees, and agents, harmless from and against any claims, liabilities, damages, losses, and expenses, including, without limitation, reasonable legal and accounting fees, arising out of or in any way connected with your access to or use of the Services or your violation of these Terms; your user content; your interaction with any user, booking of a vehicle, or creation of a listing for a vehicle; or the use, condition, or trip, including but not limited to any injuries, losses, or damages (compensatory, direct, incidental, consequential, or otherwise) of any kind arising in connection with or as a result of a booking, sharing, or use of a vehicle or optional Extra.	acceptable_consent	acceptable_consent	acceptable_consent	
You will pay Turo $5,500 in Liquidated Damages to compensate Turo for any such conduct.	financial_penalties	financial penalties	financial_penalties	
You will be responsible for all of the costs relating to any citations and fines (e.g. tolls, parking tickets, towing fines) incurred during the reservation period.	unknown_extra_cost	unknown extra cost	unknown_extra_cost	
You are responsible for assuring that the product can be lawfully imported to the destination country.	acceptable_consent	acceptable_consent	acceptable_consent	
The recipient of the shipment is the importer of record in the destination country and is responsible for all Import Fees.	unknown_extra_cost	unknown extra cost	unknown_extra_cost	
We use all the information we have-including your information-to try to keep our platform secure.	acceptable_consent	acceptable_consent	acceptable_consent	
We also may share information about misuse or harmful content with other Facebook Companies or law enforcement	sharing_data	sharing data	sharing_data	
Technologies like artificial intelligence and machine learning give us the power to apply complex processes across our Service.	acceptable_consent	acceptable_consent	acceptable_consent	
We use the information we have to study our Service and collaborate with others on research to make our Service better and contribute to the well-being of our community.	acceptable_consent	acceptable_consent	acceptable_consent	
You can't do anything unlawful, misleading, or fraudulent or for an illegal or unauthorized purpose.	acceptable_consent	acceptable_consent	acceptable_consent	
You can't post private or confidential information or do anything that violates someone else's rights, including intellectual property.	acceptable_consent	acceptable_consent	acceptable_consent	
You must obtain written permission from us or under an open source license to modify, create derivative works of, decompile, or otherwise attempt to extract source code from us.	acceptable_consent	acceptable_consent	acceptable_consent	
We collect the content, communications and other information you provide when you use our Products, including when you sign up for an account, create or share content, and message or communicate with others.	personnal_information	personnal information	personnal_information	
We collect information about the people, Pages, accounts, hashtags and groups you are connected to and how you interact with them across our Products, such as people you communicate with the most or groups you are part of	personnal_information	personnal information	personnal_information	
we collect information from and about the computers, phones, connected TVs and other web-connected devices you use that integrate with our Products, and we combine this information across different devices you use.	non_personnal_information	non personnal information	non_personnal_information	
We use the information we have about you-including information about your interests, actions and connections-to select and personalize ads, offers and other sponsored content that we show you.	sharing_data	sharing data	sharing_data	
We may resolve disputes you have with us in connection with our privacy policies and practices through TrustArc	acceptable_consent	acceptable_consent	acceptable_consent	
We provide information and content to vendors and service providers who support our business, such as by providing technical infrastructure services, analyzing how our Products are used, providing customer service, facilitating payments or conducting surveys.	sharing_data	sharing data	sharing_data	
We use the information we have (including from research partners we collaborate with) to conduct and support research and innovation on topics of general social welfare, technological advancement, public interest, health and well-being.	acceptable_consent	acceptable_consent	acceptable_consent	
We also allow third parties to place web beacons and other technologies on our site to conduct research and analysis, but we do not provide personal information to such third parties.	acceptable_consent	acceptable_consent	acceptable_consent	
We do not provide any personally identifiable customer information to these advertisers or third-party websites	acceptable_consent	acceptable_consent	acceptable_consent	
Our site includes third-party advertising and links to other websites.	acceptable_consent	acceptable_consent	acceptable_consent	
IMDb also displays personalized third-party advertising based on personal information about users	sharing_data	sharing data	sharing_data	
we may receive information about your location and your mobile device	non_personnal_information	non personnal information	non_personnal_information	
The information we learn from users helps us personalize and continually improve your experience at IMDb.	acceptable_consent	acceptable_consent	acceptable_consent	
Though an email address must be provided in order to post a comment, it is not shared or sold to third parties, and does not appear publicly on the blog.	acceptable_consent	acceptable_consent	acceptable_consent	
This Privacy Policy may be amended from time to time.	acceptable_consent	acceptable_consent	acceptable_consent	
We may access, preserve and disclose personal information if we are required to do so by law	sharing_data	sharing data	sharing_data	
We will not share, sell, rent, swap or authorize any third party to use your email address for commercial purposes without your permission.	acceptable_consent	acceptable_consent	acceptable_consent	
Social media features and widgets are either hosted by a third party or hosted directly on our web site.	acceptable_consent	acceptable_consent	acceptable_consent	
You can disassociate your NYTimes.com registration from third-party accounts any time.	acceptable_consent	acceptable_consent	acceptable_consent	
To enable payment and donations via the NYT Services, we collect and store name, address, telephone number, email address, credit card information and other billing information.	personnal_information	personnal information	personnal_information	
This information will only be shared with third parties who help to complete the purchase transaction.	sharing_data	sharing data	sharing_data	
We contract with other companies to provide services on our behalf, including credit-card and billing processing	sharing_data	sharing data	sharing_data	
